Word,Meaning,Derivates,Etymology,Additional Forms,Additional forms,Dialectal forms,Dialectal forms (1),Dialectal forms (2),Dialectal forms (3),Dialectal forms (4),Miscellaneous,Notes,Notes on correspondences,Number in CVOTGD,Number in DED,Stems,_depth,_error,_page,_record_num,_url
*ac-,thorn; to cut,,,,,,,,,,,"Dubious (we are dealing essentially with a good PNDR root ""thorn"" and a questionable parallel in Gondi). // Present in 2/6 branches.",,,,,,,1,2,
*ac-,to cut (hand; meat),,Dravidian etymology,,,,,,,,,,,,,,1,,,,https://starlingdb.org/cgi-bin/response.cgi?single=1&basename=%2fdata%2fdrav%2fgndet&text_number=1429&root=config
*aḍa-,to hide; to press down,,,,,,,,,,,"The original form of this stem is seen only in Tulu (aḍē-vuni). Most of the time, however, it is met with consonantal suffixes: PDR*aḍá-ŋ-, caus.*aḍá-p-with expected aphaeresis of the first syllable throughout Telugu and Central Dravidian languages. // Present in 5/6 branches.",,,,,,,1,3,
*aḍa-,to be hidden,,Dravidian etymology,,,,,,,,,"A bisyllabic root. In Konda it is found only with derivative suffixes, but Kui has preserved the simple form.",,,,,1,,,,https://starlingdb.org/cgi-bin/response.cgi?single=1&basename=%2fdata%2fdrav%2fgndet&text_number=129&root=config
*aḍar,"to compact, gather together; lump, clot",,,,,,,,,,,"Monosyllabic forms are also found but are in the minority and may be secondary. PNDR*aṛg-""spleen"" can go back to*aḍV́K-and fits in rather well phonetically; as for the shift in meaning, it is commonly observed in South Dravidian: cf. Tam.kaṭṭi""clod, lump, enlarged spleen"", Kod.gëṇḍe""spleen"", etc. // Present in 4/6 branches.",,,,,,,1,5,
*aḍar,herd,,Dravidian etymology,,,,,,,,,,,,,,1,,,,https://starlingdb.org/cgi-bin/response.cgi?single=1&basename=%2fdata%2fdrav%2fgndet&text_number=932&root=config
*addam,mirror,,,,,,,,,,,"A cultural term with an extremely low probability of being PDr; in fact, most of the forms can be explained as borrowings from Telugu (cf. also Tamilattamid., explicitly marked as a borrowing in DEDR). Nevertheless, the origins of the Telugu form are obscure; Burrow & Emeneau compare Prakritaddāa-'mirror', but the word does not seem to have an IE etymology and may be of Dravidian origin. // Present in 3/6 branches.",,,,,,,1,11,
*addam,mirror,,Dravidian etymology,,,,,,,,,Hardly a proper PGn root (all the forms could have easily been borrowed from Telugu).,,,,,1,,,,https://starlingdb.org/cgi-bin/response.cgi?single=1&basename=%2fdata%2fdrav%2fgndet&text_number=1433&root=config
*aḍ- (*-ḍḍ-?),to hinder; obstacle,,,,,,,,,,,"The best evidence for the inlaut voiced geminate comes from South Dravidian languages (Kannada, Kodagu, and Tulu; in the Nilgiris gemination was lost due to the geminate finding itself in the absolute auslaut position after the syncopation of the last syllable) and Telugu. As for Central Dravidian forms, many of them may actually reflect old re-borrowings from Telugu, due to both the irregular-min the auslaut and the scarceness of the forms (in many languages, only*aḍḍa-m""obstacle"" is attested without the corresponding verbal stems). However, Kondaaṛkandaḍi-are probably original. So are the NDR forms. Cf. also cases like PDR*mok- ~ *mogám""face"" in which the original*-mis almost certainly preserved in Central Dravidian languages. // Present in 6/6 branches.",,,,,,,1,12,
*aḍ- (*-ḍḍ-?),to conceal; obstacle,,Dravidian etymology,,,,,,,,,"The Kui-Kuwi forms are probably borrowed from Telugu, because geminated-ḍḍ-is not usually reconstructed for PGn.",,,,,1,,,,https://starlingdb.org/cgi-bin/response.cgi?single=1&basename=%2fdata%2fdrav%2fgndet&text_number=3&root=config
*aḍi,"foot; lower, below",,,,,,,,,,,"Cf. also Saluraḍugu""footstep"" (Burrow & Emeneau correctly indicate a borrowing from Telugu, since a trisyllabic form like this should not be expected in Gadba). // Present in 3/6 branches.",,,,,,,1,14,
*aḍi,"below, low",,Dravidian etymology,,,,,,,,,,,,,,1,,,,https://starlingdb.org/cgi-bin/response.cgi?single=1&basename=%2fdata%2fdrav%2fgndet&text_number=1038&root=config
*aḍ-,"fit, appropriate",,Nostratic etymology,,,,,,,,,"The stem is often met with resonant suffixal extensions in which the original vowel shifts to-a-(*aḍú-r->*aḍǝr->aḍar-, etc.). // Present in 4/6 branches.",,,,,,,1,17,
*aḍ-,to be able,,Dravidian etymology,,,,,,,,,"The Konda form unexpectedly changed conjugation type (aṭ-can only go back to*aḍ-C-). Vowel length in PK is irregular; as a matter of fact, Kuwi_Su has shorta-, so this variant is probably more archaic.",,,,,1,,,,https://starlingdb.org/cgi-bin/response.cgi?single=1&basename=%2fdata%2fdrav%2fgndet&text_number=25&root=config
*adm-,"to squeeze, press",,,,,,,,,,,"The auslaut-m-in this root is only ""detached"" in Tamil, and even there in most forms it can be explained as the result of a secondary loss; its status as part of the root is quite obviously Proto-Dravidian. // Present in 4/6 branches.",,,,,,,1,19,
*adm-,to press,,Dravidian etymology,,,,,,,,,,,,,,1,,,,https://starlingdb.org/cgi-bin/response.cgi?single=1&basename=%2fdata%2fdrav%2fgndet&text_number=1432&root=config
*aḍa-mb- ~ *aṭ-,to strike,,,,,,,,,,,Several different stems that may or may not go back to a single PDR root. The voiceless variant in PKG and Konda shows that the root could be monosyllabic as well (unless this is a regular development from a stem like*CVC-ú-). // Present in 4/6 branches.,,,,,,,2,1,
*aḍa-mb- ~ *aṭ-,to be hit,,Dravidian etymology,,,,,,,,,"The root was probably not used by itself in PGn. The form in Konda goes back to an old causative (hence the devoicing:aṭ-<*aḍ-p-), and there are derivatives with the suffix-mb-(in PK) and with the suffixes-ŋ-and-s-(in Konda).",,,,,1,,,,https://starlingdb.org/cgi-bin/response.cgi?single=1&basename=%2fdata%2fdrav%2fgndet&text_number=4&root=config
*aḍ-,to be near; to happen,,,,,,,,,,,"SDR languages show significant evidence for two bases:*aḍú-(""be near to, approach"") and*aḍái-(""reach, arrive, obtain""). Kannada and Tamil also have a monosyllabic stem*aṭ-""to put, place"", but this is possibly the result of contamination with*anṭ-""to join, stick, paste"". Cf. also*aḍ-[úŋ]-""to be piled up, arranged"" which may be a historical derivative of the same root. PNDR*aṭ-g-<*aḍV́-k-. // Present in 4/6 branches.",,,,,,,2,2,
*aḍ-r-,bad,,,,,,,,,,,"The root is only found in Central Dravidian languages, but cannot be successfully derived from any prototype or traced back as a borrowing. // Present in 2/6 branches.",,,,,,,2,3,
*aḍ-r-,bad,,Dravidian etymology,,,,,,,,,,,,,,1,,,,https://starlingdb.org/cgi-bin/response.cgi?single=1&basename=%2fdata%2fdrav%2fgndet&text_number=5&root=config
*aj-,mother,,Nostratic etymology,,,,,,,,,"The word was used with pronominal prefixes in PDR:*tāy'his, her mother', etc. (some of these forms are innovative). The vowel was presumably long only in prefixed forms, and later was analogized in such languages as Tamil (āy'mother').",,,,,,,2,17,
*aj-,"mother, woman",,Dravidian etymology,,,,,,,,,"The root was heavily used with posessive prefixes. The most frequent form is*yay-'my mother'. In some dialects this form became generalized, with the following shift of meaning: 'my mother' > 'mother in general', 'mother' > 'woman'. A new form, based on the 1st person pl. pronoun (Gondimāy-, Kuwimāya) resulted from the loss of initialy-and the secondary merger of the simple and the prefixed forms.",,,,,1,,,,https://starlingdb.org/cgi-bin/response.cgi?single=1&basename=%2fdata%2fdrav%2fgndet&text_number=22&root=config
*V̄j-,an elder relative (father's brother; grandfather; father),,,,,,,,,,,"A widespread Dravidian root, although the basic meaning 'father' should probably be deemed secondary due to PDR already possessing two more likely candidates:*ápa-(coll.) and*-and_-(hon.). Gondwan vocalism is obscured by possible traces of former pronominal prefixes. // Present in 4/6 branches.",,,,,,,2,18,
*V̄j-,father,,Dravidian etymology,,,,,,,,,,,,,,1,,,,https://starlingdb.org/cgi-bin/response.cgi?single=1&basename=%2fdata%2fdrav%2fgndet&text_number=1203&root=config
*ak-,an elder relative,,Nostratic etymology,,,,,,,,,"The root forms several PDR stems; the most common is*ákā~*ákai""elder sister"", but a PGn stem in*-ois also available, denoting a male rather than female relative. // Present in 4/6 branches.",,,,,,,2,20,
*ak-,grandfather (maternal),,Dravidian etymology,,,,,,,,,,,,,,1,,,,https://starlingdb.org/cgi-bin/response.cgi?single=1&basename=%2fdata%2fdrav%2fgndet&text_number=8&root=config
*a-,that (over there),,Nostratic etymology,,,,,,,,,"In the North Dravidian database cf. also*ā-r,*ā-s,*ā-d, etc. (Additional derivative entries are also available in Telugu and other databases). For Brahuidāsee DEDR 1. // Present in 6/6 branches.",,,,,,,3,1,
*a-,that (over there),,Dravidian etymology,,,,,,,,,"This deictic base had the following declineable forms in PGn:*aw-ant_[-u](whence Gondi*ōn-R, Kondavānr_uwith a metathese, etc.) 'that man', plural*aw-ar[-u]'those men'; fem.*a-d-i(PK*ādiby analogy with masculine forms), plural*a-v-i. Also reconstructed for the PGn level is*a-c-'that many, that much' (PG, PPM, PK);*a-tal'that side' (Konda, PK, possibly Gondi);*a-mb-/*a-b-'there' (Konda, PPM, PK).  An enormous number of derivatives has been formed independently in different languages (which is characteristic of all deictic bases).",,,,,1,,,,https://starlingdb.org/cgi-bin/response.cgi?single=1&basename=%2fdata%2fdrav%2fgndet&text_number=1&root=config
*al-,"to weave, plait",,,,,,,,,,,A good common PDR monosyllabic root. // Present in 5/6 branches.,,,,,,,3,2,
*al-,"to weave, plait",,Dravidian etymology,,,,,,,,,"Although the resonant here is most certainly a plain dental-l-, it becomes retroflex in Konda (cf. especially such derivative forms asaṛpa-). This is not quite clear; maybe it is a general feature of *-l- before the causative marker. Unfortunately, this is the only example of such a cluster (in a few other cases we have no BB forms with-ṛ-, which are diagnostic).",,,,,1,,,,https://starlingdb.org/cgi-bin/response.cgi?single=1&basename=%2fdata%2fdrav%2fgndet&text_number=9&root=config
*al-,negative morpheme,,Nostratic etymology,,,,,,,,,"A rather common negation morpheme with well-known Nostratic parallels. Its main competition is PDR*śil-with more or less the same meaning (sometimes the two forms are in complementary distribution between branches - e. g. only*śil-is found in Telugu, onlyall-in Brahui). // Present in 4/6 branches.",,,,,,,3,3,
*aḷ-nǯ-,"to sprinkle, bail out",,Nostratic etymology,,,,,,,,,,,,,,,,3,4,
*aḷ-nǯ-,to bail out,,Dravidian etymology,,,,,,,,,The root existed in PK only with the suffix*-nj-.,,,,,1,,,,https://starlingdb.org/cgi-bin/response.cgi?single=1&basename=%2fdata%2fdrav%2fgndet&text_number=10&root=config
*alāv-,fat; strength,,Nostratic etymology,,,,,,,,,It is not excluded that most of the Central Dravidian forms are re-borrowed from Telugu.,,,,,,,3,5,
*alav-,strength,,Dravidian etymology,,,,,,,,,Bisyllabic root.,,,,,1,,,,https://starlingdb.org/cgi-bin/response.cgi?single=1&basename=%2fdata%2fdrav%2fgndet&text_number=1039&root=config
*almi-,"to spread, cover",,Nostratic etymology,,,,,,,,,,,,,,,,3,8,
*almi-,"to level, spread out",,Dravidian etymology,,,,,,,,,,,,,,1,,,,https://starlingdb.org/cgi-bin/response.cgi?single=1&basename=%2fdata%2fdrav%2fgndet&text_number=1401&root=config
*aLa-c-,to measure,,Nostratic etymology,,,,,,,,,,,,,,,,3,11,
*aLa-c-,to measure,,Dravidian etymology,,,,,,,,,Bisyllabic root.,,,,,1,,,,https://starlingdb.org/cgi-bin/response.cgi?single=1&basename=%2fdata%2fdrav%2fgndet&text_number=387&root=config
*lab- (?),"to mix; to join, approach",,,,,,,,,,,The PGn form is dubious.,,,,,,,3,12,
*lab-,"to fit in, to join",,Dravidian etymology,,,,,,,,,,,,,,1,,,,https://starlingdb.org/cgi-bin/response.cgi?single=1&basename=%2fdata%2fdrav%2fgndet&text_number=980&root=config
*alg-,parched rice,,,,,,,,,,,"A Tamil-Kui-Kurukh isogloss, probably referring to a special procedure of obtaining rice from paddy. // Present in 3/6 branches.",,,,,,,3,15,
*alg-,a way of obtaining rice,,Dravidian etymology,,,,,,,,,,,,,,1,,,,https://starlingdb.org/cgi-bin/response.cgi?single=1&basename=%2fdata%2fdrav%2fgndet&text_number=1438&root=config
*[V]l[V]-mb- (?),"to wave, move from side to side, wander",,,,,,,,,,,"A good PDR root with many suffixal derivatives (*ala-ŋ-,*ala-mb-) and rather wide-reaching semantics. Occasional contaminations with*alá-'to suffer, be confused' are noted. Not all the forms in DEDR 240 can actually belong here without violating correspondences: e. g. Kuilānga'to be fickle, changeable' should be discarded because Kuil-< PGn (PDR)*ḷ-, whereas alveolarlusually yieldsḍ-orṛ-when found in initial position. // Present in 3/6 branches.",,,,,,,3,16,
*[V]l[V]-mb- (?),"to shake, tremble",,Dravidian etymology,,,,,,,,,"An isolated Pengo form that nevertheless corresponds rather well to PDR*ala-(especially in the light of such forms as Tam.ala-mpu, etc.).",,,,,1,,,,https://starlingdb.org/cgi-bin/response.cgi?single=1&basename=%2fdata%2fdrav%2fgndet&text_number=1436&root=config
*ale,vocative interjection,,,,,,,,,,,A surprisingly well-represented common PDR interjection. // Present in 4/6 branches.,,,,,,,3,19,
*ale,interjection,,Dravidian etymology,,,,,,,,,,,,,,1,,,,https://starlingdb.org/cgi-bin/response.cgi?single=1&basename=%2fdata%2fdrav%2fgndet&text_number=1437&root=config
*amma-,mother (hon.),,Nostratic etymology,,,,,,,,,"The most common, and most certainly, primary meaning of the stem is 'mother'; however, much like*ápa-, this is the ""formal"" root for this relative, and is in that function opposed to*aj-q. v. // Present in 5/6 branches.",,,,,,,4,3,
*amma-,female relative,,Dravidian etymology,,,,,,,,,"The Gondi semantic shift to 'father' can be connected with the ""extra"" suffix-l.",,,,,1,,,,https://starlingdb.org/cgi-bin/response.cgi?single=1&basename=%2fdata%2fdrav%2fgndet&text_number=11&root=config
*amb-,arrow,,,,,,,,,,,Forms like Tamilappu-kkaṭṭu'sheaf of arrows'; Teluguampar_a(pl.) 'arrows'; and possibly Gondwan plural forms inap-hint at the PDR status of the morphological gradation*amb-(sg. stem) ~*amp-(plural and derivative forms). // Present in 4/6 branches.,,,,,,,4,6,
*amb-,arrow,,Dravidian etymology,,,,,,,,,,,,,,1,,,,https://starlingdb.org/cgi-bin/response.cgi?single=1&basename=%2fdata%2fdrav%2fgndet&text_number=13&root=config
*ambeli,rice-water; rice gruel,,Nostratic etymology,,,,,,,,,The presence of the root in North Dravidian clearly validates its PDR status (otherwise one could argue that all Central Dravidian languages - as well as some South Dravidian ones - have borrowed the form from Telugu). // Present in 5/6 branches.,,,,,,,4,8,
*ambeli,"porridge, gruel",,Dravidian etymology,,,,,,,,,"The Proto-Gondwan character of this root is dubious, especially since the regular reflex of PDR*-mb-in Gondi is-m-. Some, or all of the forms, could have been re-borrowed from Telugu.",,,,,1,,,,https://starlingdb.org/cgi-bin/response.cgi?single=1&basename=%2fdata%2fdrav%2fgndet&text_number=12&root=config
*ana,elder brother,,Nostratic etymology,,,,,,,,,Loss of retroflex articulation in PGn is normal in this position. // Present in 4/6 branches.,,,,,,,4,11,
*ana,elder brother,,Dravidian etymology,,,,,,,,,,,,,,1,,,,https://starlingdb.org/cgi-bin/response.cgi?single=1&basename=%2fdata%2fdrav%2fgndet&text_number=1040&root=config
*anḍ-,"to join, unite",,Nostratic etymology,,,,,,,,,"A common PDR stem commonly displaying two variants, with*anḍ-being the exclusive one in all of Central Dravidian and*aṇái-safely reconstructed only for PSDR (and Telugu, ifanãgu'to mix' really belongs here). Some of the forms with-ṇṭ-may be due to contamination with*anṭ-'to stick'. The two stems, bisyllabic and monosyllabic with retroflex cluster, may well be related on a higher level (with the original root being*aṇ-, which then may have been preserved as an archaism in Tam.aṇṇu), but separate origins cannot be excluded either. // Present in 6/6 branches.",,,,,,,4,13,
*anḍ-,"to join, meet; to stick",,Dravidian etymology,,,,,,,,,"The root probably contaminated with*a[n]ṭ-'to stick', whence the meaning in PPM.",,,,,1,,,,https://starlingdb.org/cgi-bin/response.cgi?single=1&basename=%2fdata%2fdrav%2fgndet&text_number=14&root=config
*and-,to be within reach,,,,,,,,,,,"Very sporadic representation, but correspondences are regular. // Present in 3/6 branches.",,,,,,,4,18,
*and-,to reach,,Dravidian etymology,,,,,,,,,,,,,,1,,,,https://starlingdb.org/cgi-bin/response.cgi?single=1&basename=%2fdata%2fdrav%2fgndet&text_number=1434&root=config
*a[n]ṭ-,to stick,,,,,,,,,,,See also*anḍ-'to join'. // Present in 4/6 branches.,,,,,,,5,4,
*a[n]ṭ-,to stick,,Dravidian etymology,,,,,,,,,"Although the root is actually present only in PK, its traces can be found in contamination with PPM*anḍ-.",,,,,1,,,,https://starlingdb.org/cgi-bin/response.cgi?single=1&basename=%2fdata%2fdrav%2fgndet&text_number=19&root=config
*aǯ-,to fear,,,,,,,,,,,"PGn (PKK)*aǯ-lacks an -n-, probably for back-formation reasons (PKK*aǯ-< caus. stem*as-). The relation to Brahuihīj-ing'to be scared, startled' is unclear. // Present in 3/6 branches.",,,,,,,5,6,
*aǯ-,to fear,,Dravidian etymology,,,,,,,,,"Of all Central Dravidian languages the root is present only in PKK. Nevertheless, it has good SDR parallels and is well represented in both Kui and Kuwi, so the possibility of borrowing is very low.",,,,,1,,,,https://starlingdb.org/cgi-bin/response.cgi?single=1&basename=%2fdata%2fdrav%2fgndet&text_number=7&root=config
"*aŋi, *taŋi",a k. of relative (brother/sister),,,,,,,,,,,Used extensively with pronominal prefixes.,,,,,,,5,7,
"*aŋi, *taŋi",younger sister,,Dravidian etymology,,,,,,,,,,,,,,1,,,,https://starlingdb.org/cgi-bin/response.cgi?single=1&basename=%2fdata%2fdrav%2fgndet&text_number=160&root=config
*aŋl-,"to yawn, gape",,Nostratic etymology,,,,,,,,,A bisyllabic root with the inlaut nasal cluster (*-ŋ-=*-ŋg-) in a strong position. Auslaut*-l-is most probably lost in SDR where bisyllabic roots of this kind (with a second long vowel) never end in liquid resonants. // Present in 4/6 branches.,,,,,,,5,10,
*aŋl-,"to open mouth, to yawn",,Dravidian etymology,,,,,,,,,,,,,,1,,,,https://starlingdb.org/cgi-bin/response.cgi?single=1&basename=%2fdata%2fdrav%2fgndet&text_number=23&root=config
*ā̆p-,father (hon.),,Nostratic etymology,,,,,,,,,"Irregular (expressive?) vowel lengthening is observed in some Gondwan languages. This is one of the two main PDR roots for 'father', the other being*t-and_-; judging by the difference in meaning, the latter was the more 'formal' appellation (which is why it is more frequently met with archaic pronominal prefixes than*ápa-), whereas the latter is clearly a ""children's"" word. // Present in 4/6 branches.",,,,,,,5,13,
*ā̆p-,father,,Dravidian etymology,,,,,,,,,"In Kui a shift of meaning: 'father' > 'son' (such a shift happens in SDR as well, when the word for 'father' is applied to children as term of endearment).",,,,,1,,,,https://starlingdb.org/cgi-bin/response.cgi?single=1&basename=%2fdata%2fdrav%2fgndet&text_number=32&root=config
*rā- ~ *rē-,to rub two things against each other (> to grind; to launder),,,,,,,,,,,"The entry in DEDR is a perfect example of the frequently witnessed confusion of data: it gives Konḍarēs-'to stir and mix, to plate (metals)' as a potential cognate, but later on the same form (rēs-) resurfaces in DEDR 3949 as 'to make plating (of metals)' andstilllater on in DEDR 4610 as 'to stir, mix' (!!!). This is, of course, due to the fact that proper reflexation of PDR auslaut vocalism in syncopated roots in Gondwan is rather hard to establish. // Present in 4/6 branches.",,,,,,,5,17,
*rā- ~ *rē-,to rub; to mix,,Dravidian etymology,,,,,,,,,"Possibly more than one root involved; unfortunately, Gondwan reflexes of former bisyllabic verbal bases with a vocalic anlaut are quite poorly studied.",,,,,1,,,,https://starlingdb.org/cgi-bin/response.cgi?single=1&basename=%2fdata%2fdrav%2fgndet&text_number=682&root=config
*rāji,Ficus religiosa,,,,,,,,,,,"In Telugu (and Kolami, ifrāviis not a re-borrowing from Telugu) there has probably occurred an early dissimilation*arajai>*aragai, from whence the dialectal variation between-g-and-v-. // Present in 4/6 branches.",,,,,,,5,19,
*rāji,Ficus religiosa,,Dravidian etymology,,,,,,,,,,,,,,1,,,,https://starlingdb.org/cgi-bin/response.cgi?single=1&basename=%2fdata%2fdrav%2fgndet&text_number=1435&root=config
*arɣil-,chest (of body),,,,,,,,,,,"A Central Dravidian isogloss. The element*-gil-may be an old suffix (cf. the derivative form*kavŋ-gil-from*kavŋ-'armpit'); however, the root*ar-still has no reliable parallels outside Central Dravidian. // Present in 2/6 branches.",,,,,,,5,20,
*arɣil-,chest; udder,,Dravidian etymology,,,,,,,,,,,,,,1,,,,https://starlingdb.org/cgi-bin/response.cgi?single=1&basename=%2fdata%2fdrav%2fgndet&text_number=1279&root=config
*rat- (< *arat-),"to cut, chip",,,,,,,,,,,The simple stem is only seen in SDR; Central Dravidian languages have preserved the derivative stems*arak-and*arat-. // Present in 3/6 branches.,,,,,,,6,1,
*rat- (< *arat-),to cut,,Dravidian etymology,,,,,,,,,"The Kui-Kuwi forms can easily be traced back to a former transitive verbal stem (*ará-t-< PDR*ari-+*-t-). More problematic is Pengoraz-, which should normally go back to*arád_-. It is unclear if this is a real alternate stem or an irregular development in a non-trivial context.",,,,,1,,,,https://starlingdb.org/cgi-bin/response.cgi?single=1&basename=%2fdata%2fdrav%2fgndet&text_number=681&root=config
*ari-,to fall,,,,,,,,,,,"The Telugu-PKG forms, on one hand, and the Gondwan forms, on the other, are somewhat hard to reconciliate. PGn shows a bisyllabic root (not necessarily with an auslaut-i-, since the latter is only tentatively set up based on forms like Kuwirī-ali, etc.; in reality this could have been any vowel but a labialised one) with a vocalic auslaut, whereas Telugu and PKG reflect an older variant like*arál-. Of course, if we assume the suffixal nature of the resonant, the question is resolved, although the meaning of the suffix is still unclear. No traces of the root are seen in SDR, where the main word for 'fall' is*vīẓ-- which, in its turn, has been quite poorly preserved outside of SDR. Some overlapping, however, exists, which leads us to surmise that the difference between the two roots in PDR must have been stylistic -*arí-/*arál-being the neutral, unmarked 'fall', and*vīẓ-being its ""Magn"" correlate, i. e. ""to topple over, crumble"", whence the figurative development > ""die"" in some languages. In SDR both roots eventually converged into one. // Present in 3/6 branches.",,,,,,,6,5,
*ari-,to fall,,Dravidian etymology,,,,,,,,,Bisyllabic root.,,,,,1,,,,https://starlingdb.org/cgi-bin/response.cgi?single=1&basename=%2fdata%2fdrav%2fgndet&text_number=690&root=config
*ar_-k-,to be digested,,,,,,,,,,,,,,,,,,6,12,
*ar_-k-,to be digested,,Dravidian etymology,,,,,,,,,The root was used only with the suffix*-k-(assimilated to the voiced*-r_-after reduction in Konda and PK).,,,,,1,,,,https://starlingdb.org/cgi-bin/response.cgi?single=1&basename=%2fdata%2fdrav%2fgndet&text_number=16&root=config
*as-,"to join two things together (> ""to take, buy"")",,,,,,,,,,,DEDR 43 and 51 (a connection between the two is proposed by Burrow & Emeneau themselves on the grounds of identical forms in Gondwan). // Present in 3/6 branches.,,,,,,,6,19,
*as-,"to take, buy",,Dravidian etymology,,,,,,,,,Causative type of conjugation in PGn.,,,,,1,,,,https://starlingdb.org/cgi-bin/response.cgi?single=1&basename=%2fdata%2fdrav%2fgndet&text_number=17&root=config
*ad-k-,"to join, attach, wear",,,,,,,,,,,The root is more often found with the derivative suffix*-k-and an epenthetic vowel:*ad-ú-k-.,,,,,,,7,1,
*ad-k-,"to tie, attach",,Dravidian etymology,,,,,,,,,,,,,,1,,,,https://starlingdb.org/cgi-bin/response.cgi?single=1&basename=%2fdata%2fdrav%2fgndet&text_number=1041&root=config
*aṭka,earthen pot,,,,,,,,,,,"SDR forms, on one hand, and Telugu, PKG, and PGn forms, on the other, can hardly be traced back to the same stem; the former look like quadrisyllabic compounds (*aḍí-KarV, with the vowel in a weak position) whereas the latter can only go back to*áṭikV, a trisyllabic stem with the vowel in a strong position and a nominal suffix tacked on at the end. Nevertheless, if Burrow & Emeneau are correct about comparing the forms to PDR*áṭ- ~ *aḍú-""to cook"", the two variants may indeed share the same archaic root. // Present in 5/6 branches.",,,,,,,7,2,
*aṭka,cooking pot,,Dravidian etymology,,,,,,,,,,,,,,1,,,,https://starlingdb.org/cgi-bin/response.cgi?single=1&basename=%2fdata%2fdrav%2fgndet&text_number=1430&root=config
*at-,female relative (father's sister; grandmother),,Nostratic etymology,,,,,,,,,"The meaning 'father' (somewhat expectable from a root likeata-) is actually present in Tamil and Malayalam, but nowhere else in Dravidian. The archaicness of this meaning in Tamil cannot be excluded; more probable, however, is the idea that in Tamil the word has developed a parallel masculine stem by analogy with*ápa-q. v. (the latter does have 'masculine' meanings outside of Tamil). // Present in 4/6 branches.",,,,,,,7,3,
*at-,female relative,,Dravidian etymology,,,,,,,,,"Vowel length in Gondi is not quite clear, maybe expressive (such a lengthening does happen sometimes in relation terms).",,,,,1,,,,https://starlingdb.org/cgi-bin/response.cgi?single=1&basename=%2fdata%2fdrav%2fgndet&text_number=18&root=config
